Name,Date,Location,Type,Region,Weather
Joe Casalini Trio,12/27/2024,The Royal Room,Music,South Seattle,"Rain. Cloudy, with a high near 50. Chance of precipitation is 100%. New rainfall amounts between a quarter and half of an inch possible."
Fruit Juice,12/28/2024,Sunset Tavern,Music,Fremont / Ballard,"Rain. Mostly cloudy, with a high near 50."
Queen Mother and The Little Lies,12/28/2024,Neumos,Music,Capitol Hill / Central District,"Rain. Mostly cloudy, with a high near 51."
Hanukkah at the Royal Room,12/29/2024,The Royal Room,Music,South Seattle,"Rain. Cloudy, with a high near 48."
Jenny Don’t and The Spurs,12/30/2024,Tractor Tavern,Music,Fremont / Ballard,"Rain likely. Mostly cloudy, with a high near 47."
New Wave New Years Eve,12/31/2024,High Dive,Music,Fremont / Ballard,"A chance of rain. Mostly cloudy, with a high near 46."
New Year’s Eve Concert & Party,12/31/2024,Benaroya Hall,Music,Downtown,"A chance of rain. Mostly cloudy, with a high near 46."
New Years Eve,12/31/2024,Slim's Last Chance,Music,South Seattle,"A chance of rain. Mostly cloudy, with a high near 45."
