Name,Date,Location,Type,Region,Weather
A Festival of Lessons and Carols,12/23/2024,Benaroya Hall,Music,Downtown,"Partly cloudy. Low around 46, with temperatures rising to around 48 overnight. South wind around 8 mph."
Home for the Holidays,12/23/2024,The Royal Room,Music,South Seattle,"Partly cloudy. Low around 46, with temperatures rising to around 48 overnight. South wind around 8 mph."
Joe Casalini Trio,12/27/2024,The Royal Room,Music,South Seattle,"Rain. Cloudy, with a high near 50."
Fruit Juice,12/28/2024,Sunset Tavern,Music,Fremont / Ballard,"Rain. Cloudy, with a high near 50."
Queen Mother and The Little Lies,12/28/2024,Neumos,Music,Capitol Hill / Central District,"Rain. Cloudy, with a high near 51."
Hanukkah at the Royal Room,12/29/2024,The Royal Room,Music,South Seattle,"Rain. Cloudy, with a high near 49."
