Name,Date,Location,Type,Region,Weather
Seattle Kraken vs. Calgary Flames,4/11/2026,Climate Pledge Arena,Sports,Queen Anne / Seattle Center,"Rain. Cloudy, with a high near 54. South wind around 6 mph. Chance of precipitation is 90%. New rainfall amounts between a quarter and half of an inch possible."
Deafbloom,4/12/2026,Barboza,Music,Capitol Hill / Central District,"A chance of rain after 5pm. Partly sunny, with a high near 59. North northwest wind around 5 mph. Chance of precipitation is 40%."
Seattle Kraken vs. Los Angeles Kings,4/13/2026,Climate Pledge Arena,Sports,Queen Anne / Seattle Center,"A chance of rain. Mostly cloudy, with a high near 56. South southwest wind around 9 mph. Chance of precipitation is 40%."
April,4/14/2026,The Royal Room,Music,South Seattle,"Rain. Cloudy, with a high near 49."
U.S. Women’s National Team Match (USA vs Japan),4/14/2026,Lumen Field,Sports,Pioneer Square,"Rain. Cloudy, with a high near 49."
MFG aka Maxwell Friedman Group with McTuff ‘The V3’,4/15/2026,Hidden Hall,Music,Fremont / Ballard,"A chance of rain before 11am, then showers and thunderstorms likely between 11am and 5pm, then a chance of rain. Partly sunny, with a high near 51."
Sleepy Cat,4/15/2026,Barboza,Music,Capitol Hill / Central District,"A chance of rain before 11am, then showers and thunderstorms likely between 11am and 5pm, then a chance of rain. Partly sunny, with a high near 51."
DJ Lex,4/16/2026,Neumos,Music,Capitol Hill / Central District,"A slight chance of rain between 11am and 5pm. Mostly sunny, with a high near 55."
