Name,Date,Location,Type,Region,Weather
Artists’ Reception & Panel Conversation for Bloedel Reserve: 10 Years of Creative Residencies,9/17/2025,Bainbridge Island Museum of Art,Museums,West,"Sunny. High near 74, with temperatures falling to around 70 in the afternoon. West southwest wind around 7 mph."
Be’lakor,9/18/2025,El Corazon,Music,Downtown,"Mostly sunny, with a high near 69. North wind 2 to 8 mph."
Black Dogs,9/18/2025,Sea Monster Lounge,Music,Wallingford / Greenlake,"Mostly sunny, with a high near 68. North wind 2 to 9 mph."
Duffy Bishop,9/18/2025,The Triple Door,Music,Downtown,"Mostly sunny, with a high near 67. North wind 3 to 10 mph."
"Basements, The Rags, The No. 3",9/19/2025,Sunset Tavern,Music,Fremont / Ballard,"Sunny, with a high near 71."
Canadian Steam,9/19/2025,The Triple Door,Theatre,Downtown,"Sunny, with a high near 72. North wind 2 to 6 mph."
Babes in Canyon Album Release Show,9/20/2025,Tractor Tavern,Music,Fremont / Ballard,"A chance of rain after 5pm. Partly sunny, with a high near 70."
Curated Conversations: Juliette Aristides,9/21/2025,Bainbridge Island Museum of Art,Museums,West,"Rain likely. Partly sunny, with a high near 68."
Greg Norton and Buddies,9/21/2025,Funhouse,Music,Capitol Hill / Central District,"Rain likely. Partly sunny, with a high near 68."
