Name,Date,Location,Type,Region,Weather
Card Magic By Jason LaDanye,9/24/2025,The Triple Door,Theatre,Downtown,"Sunny, with a high near 71."
Birdtalker,9/27/2025,Tractor Tavern,Music,Fremont / Ballard,"A chance of rain. Partly sunny, with a high near 67."
Kathleen Madigan,9/27/2025,The Moore Theatre,Music,Downtown,"A chance of rain. Partly sunny, with a high near 68."
Sol De Noche – Argentine Tango Concert,9/27/2025,Fountainhead Gallery,Music,Queen Anne / Seattle Center,"A chance of rain. Partly sunny, with a high near 68."
Global Rhythms: Kiki Valera,9/28/2025,Town Hall Seattle,Music,Downtown,"A chance of rain. Partly sunny, with a high near 69."
